{
  "change_request_id": "cr-2026-05-18-001",
  "title": "Add WMS SKU mapping for Atlas sand rug",
  "change_type": "fulfillment",
  "affected_domains": ["order", "fulfillment", "wms"],
  "risk_level": "high",
  "summary": "Add a missing SKU mapping so Shopify rug orders can be transformed into mock WMS orders.",
  "proposed_by": "codex",
  "requires_review": true,
  "context_pack": [
    "docs/commerce/order-fulfillment-flow.md",
    "docs/commerce/custom-services-boundaries.md",
    "schemas/canonical-order.schema.json",
    "schemas/mock-wms-order.schema.json",
    "docs/checklists/integration-flow-checklist.md"
  ],
  "created_at": "2026-05-18T11:00:00Z"
}
